{
  "$schema": "https://json-schema.org/draft/2020-12/schema",
  "$id": "https://r-ai-cing-nexus.local/schemas/gate-checkpoint.schema.json",
  "title": "Racing Intelligence Lab gate checkpoint",
  "type": "object",
  "additionalProperties": false,
  "required": [
    "gate",
    "title",
    "status",
    "completed",
    "commands",
    "security",
    "data_mode",
    "data_rights",
    "model_status",
    "evidence",
    "cost",
    "risks",
    "owner_decisions",
    "next_unblocked_gate"
  ],
  "properties": {
    "gate": { "type": "string", "pattern": "^G(0|1|2|3|4|5|6|7|8|9|10|11)$" },
    "title": { "type": "string", "minLength": 1 },
    "status": { "enum": ["PASS", "CONDITIONAL_PASS", "BLOCKED", "FAIL"] },
    "completed": { "type": "array", "items": { "type": "string" } },
    "commands": {
      "type": "array",
      "items": {
        "type": "object",
        "additionalProperties": false,
        "required": ["command", "exit_code", "observed_at_utc"],
        "properties": {
          "command": { "type": "string", "minLength": 1 },
          "exit_code": { "type": "integer" },
          "observed_at_utc": { "type": "string", "format": "date-time" },
          "result": { "type": "string" }
        }
      }
    },
    "security": { "type": "array", "items": { "type": "string" } },
    "data_mode": { "enum": ["NONE", "SYNTHETIC_ONLY", "SCRAPED_PUBLIC", "APPROVED_LICENSED", "MIXED"] },
    "data_rights": { "type": "array", "items": { "type": "string" } },
    "model_status": { "enum": ["NOT_TRAINED", "ILLUSTRATIVE_BASELINE", "EXPERIMENTAL", "SHADOW", "VALIDATED"] },
    "evidence": { "type": "array", "items": { "type": "string" } },
    "cost": {
      "type": "object",
      "additionalProperties": false,
      "required": ["actual_aud", "planned_aud", "unknowns"],
      "properties": {
        "actual_aud": { "type": "number", "minimum": 0 },
        "planned_aud": { "type": "number", "minimum": 0 },
        "unknowns": { "type": "array", "items": { "type": "string" } }
      }
    },
    "risks": { "type": "array", "items": { "type": "string" } },
    "owner_decisions": { "type": "array", "items": { "type": "string" } },
    "next_unblocked_gate": { "type": "string", "pattern": "^G(0|1|2|3|4|5|6|7|8|9|10|11)$" }
  }
}
